sequence,target,cost,price,how much
how much to frame a house,,No,No,Yes
tricare cost for retired military,,Yes,No,No
current price berkshire hathaway b stock,,No,Yes,No
how much are tattoos,,No,No,Yes
average cost of commercial janitorial services,,Yes,No,No
timing belts price,,No,Yes,No
how much do a dentist make,,No,No,Yes
cost of aarp driver safety course,,Yes,No,No
cost of shed kits,,Yes,No,No
average price prp injections for hair loss,,No,Yes,No
concrete flooring cost,yelp_intent,Yes,No,No
dental resin composite cost,yelp_intent,Yes,No,No
deck construction cost,yelp_intent,Yes,No,No
blepharoplasty average cost,,Yes,No,No
current copper prices per pound,,No,Yes,No
how much does an average car salesman make,,No,No,Yes
price of corvettes,,No,Yes,No
fafsa application cost,,Yes,No,No
how much is an apple watch,,No,No,Yes
comex price of copper,,No,Yes,No
car axle cost,,Yes,No,No
how much does hbo now cost at amazon,,Yes,No,Yes
how much does a radiologist make,,No,No,Yes
how much juice a lemon yieds,,No,No,Yes
how much is a cna license,,No,No,Yes
watch vincent price movies,,No,Yes,No
how much is a private pilot license,,No,No,Yes
stock price centurylink,,No,Yes,No
walmart carpet cleaner rental cost,,Yes,No,No
cost of valve replacement,,Yes,No,No
how much do foster parents get paid,,No,No,Yes
cost of a ride on a hot air balloon,,Yes,No,No
cost cutters prices,,Yes,Yes,No
how much does nurses get paid monthly,,No,No,Yes
cost to asphalt driveway,,Yes,No,No
how much is the water bill per month,,No,No,Yes
average cost of mortgage life insurance,,Yes,No,No
prices of ge dryers,,No,Yes,No
master cylinder cost,,Yes,No,No
fm radio cost,,Yes,No,No
square stock price.,,No,Yes,No
ped stock price,,No,Yes,No
cost of a lawn sweeper,,Yes,No,No
cost of replacement windows,,Yes,No,No
estee lauder companies stock price,,No,Yes,No
cost of hyundai tucson,,Yes,No,No
door actuator replacement cost,,Yes,No,No
how much do a funeral cost,,Yes,No,Yes
aon hewitt stock price,,No,Yes,No
steel building houses cost,,Yes,No,No
bid price vs ask,,No,Yes,No
cost of carpenter ant treatment,,Yes,No,No
cost to install inground pools,,Yes,No,No
lg watch sport price,,No,Yes,No
acura tl price,,No,Yes,No
how much weight does a piece of paper hold up,,No,No,Yes
stock price comcast,,No,Yes,No
acan stock target price,,No,Yes,No
deb stock price,,No,Yes,No
skateboard ramp cost,,Yes,No,No
the price mechanism is,,No,Yes,No
cost of intravitreal injection in india,,Yes,No,No
cost parking downtown san antonio,,Yes,No,No
was james earl jones in darth vader costume,,Yes,No,No
house gutters cost,,Yes,No,No
contact lenses walmart price,,No,Yes,No
white house tour prices,,No,Yes,No
mexican hairless dog cost,yelp_intent,Yes,No,No
how much for forever stamps,,No,No,Yes
what is the cost of lipotropic injections,,Yes,No,No
how much are pit bull terriers,,No,No,Yes
cost of cinder block,,Yes,No,No
cost of hip mri,,Yes,No,No
countertop comparison cost,yelp_intent,Yes,No,No
how much caffeine per day is recommended,,No,No,Yes
asphalt shingle cost,,Yes,No,No
how much is jennifer aniston worth,,No,No,Yes
cost model for services,,Yes,No,No
cost of care diabetes,,Yes,No,No
how much do home inspection cost,,Yes,No,Yes
current walt disney world ticket prices,,No,Yes,No
cost of pvc fence,yelp_intent,Yes,No,No
bombardier stock price,,No,Yes,No
frta stock price,,No,Yes,No
cost cutters evergreen,,Yes,No,No
amgen stock price after hours,,No,Yes,No
hearing aids consumer prices,,No,Yes,No
cost of a paver walkway,,Yes,No,No
cost of a used honda civic,,Yes,No,No
2017 cars and prices,,No,Yes,No
what does a limo rental cost,,Yes,No,No
intravenous therapy cost,,Yes,No,No
price of lupron injection,,No,Yes,No
umc stock price,,No,Yes,No
microblading training cost,yelp_intent,Yes,No,No
how much does a average teacher make an hour,,No,No,Yes
how much do hedgehogs cost monthly,,Yes,No,Yes
granite vs tile countertops cost,yelp_intent,Yes,No,No
cubs season tickets price,,No,Yes,No
cost of meijer home delivery,,Yes,No,No
iphone 6s plus full price,,No,Yes,No
gs lexus cost,,Yes,No,No
average health care insurance cost per month,,Yes,No,No
whole foods cost of organic whole chicken,,Yes,No,No
tesla service cost,,Yes,No,No
cost to disney world orlando,,Yes,No,No
cost of endoscopy procedure,,Yes,No,No
cost of baltimore ravens season tickets,information_intent,Yes,No,No
average cost of a roof replacement,yelp_intent,Yes,No,No
cost for carpet on stairs,yelp_intent,Yes,No,No
cost of sales examples,information_intent,Yes,No,No
how much do hearing aids cost,information_intent,Yes,No,Yes
how much does it cost to get married in vegas,information_intent,Yes,No,Yes
how much is gold medal worth,information_intent,No,No,Yes
the mirage buffet prices,,No,Yes,No
cost guide for construction,,Yes,No,No
toronto zoo price,information_intent,No,Yes,No
how much is susan lucci worth,information_intent,No,No,Yes
costco price on dyson vacuum,information_intent,Yes,Yes,No
how much is the fidget spinner,information_intent,No,No,Yes
new ford ranger cost,information_intent,Yes,No,No
a gram is how much,information_intent,No,No,Yes
price for a hyundai sonata,information_intent,No,Yes,No
steel building insulation cost,,Yes,No,No
cost asphalt filler and sealer,,Yes,No,No
how much does a lamborghini cost huracan,,Yes,No,Yes
drivers license renewal wi cost,information_intent,Yes,No,No
cost of landscape boulders,,Yes,No,No
room addition cost,,Yes,No,No
what is the stock price of american express,,No,Yes,No
invega oral medication cost,information_intent,Yes,No,No
infinity gauntlet comic price,,No,Yes,No
price at golden corral,information_intent,No,Yes,No
price of dish flex pack,,No,Yes,No
how much is oprah winfrey's net worth,information_intent,No,No,Yes
uvita costa rica average weather,information_intent,Yes,No,No
how much are the boat rentals at lake norman,,No,No,Yes
walmart moneygram cost,information_intent,Yes,No,No
google glass price,,No,Yes,No
how much does a basketball player make,,No,No,Yes
seagate technology stock price,information_intent,No,Yes,No
cost to rebuild engine,,Yes,No,No
cost of vietnam visa for us citizens,,Yes,No,No
cost of a log cabin kit,,Yes,No,No
license renewal cost illinois,information_intent,Yes,No,No
average granite price,,No,Yes,No
how much does stamps.com cost,,Yes,No,Yes
cost of professional cleaning services,,Yes,No,No
warby parker lenses cost,,Yes,No,No
nintendo switch games cost,,Yes,No,No
racing wheelchair cost,,Yes,No,No
direct tv nfl network cost,,Yes,No,No
netflix content cost,,Yes,No,No
low price granite countertops,,No,Yes,No
cost to mail certified mail receipt,,Yes,No,No
does costco sell seaweed salad,,Yes,No,No
cost for coolsculpting,,Yes,No,No
who pays closing costs in texas,,Yes,No,No
cost of full mouth dental implants,yelp_intent,Yes,No,No
cost to build a deck,yelp_intent,Yes,No,No
cost of notary services,,Yes,No,No
cost of living in sines portugal,,Yes,No,No
what is considered closing costs,,Yes,No,No
how much do nurse practitioner make,,No,No,Yes
cost for bale of barley straw,,Yes,No,No
pgt windows prices,,No,Yes,No
iphone for boost mobile prices,,No,Yes,No
flush brake fluid cost,yelp_intent,Yes,No,No
counting on how much do duggars make,,No,No,Yes
price adobe acrobat pro,,No,Yes,No
indirect labor cost vs direct labor cost,,Yes,No,No
how much does a vet make per year,,No,No,Yes
average cost in remodel a kitchen,,Yes,No,No
how much are hedgehogs,,No,No,Yes
weight watchers cost,,Yes,No,No
cost to add crown molding,,Yes,No,No
cost to get married at the courthouse,,Yes,No,No
how much am i supposed to weigh,,No,No,Yes
cost of renewing missouri driver's license,information_intent,Yes,No,No
missouri llc cost,,Yes,No,No
how much does a yard of gravel,,No,No,Yes
how much money is dolly parton worth,,No,No,Yes
what is price war,,No,Yes,No
nintendo switch official price,,No,Yes,No
average cost of small bathroom makeover,,Yes,No,No
approximate cost of assisted living facilities,,Yes,No,No
how much does a medical assistant make,,No,No,Yes
jeep rubicon brute price,,No,Yes,No
cost of a day of wedding coordinator,yelp_intent,Yes,No,No
cost of generac home standby generator,,Yes,No,No
cost of gutter cleaning,,Yes,No,No
what airline fly to costa rica,,Yes,No,No
gas price for mileage,,No,Yes,No
how much caffeine can you have pregnant,,No,No,Yes
cost of earthquake insurance in southern california,,Yes,No,No
road gravel cost,,Yes,No,No
price of neulasta,,No,Yes,No
medicare cost report training,,Yes,No,No
how much cinnamon for weight loss,,No,No,Yes
building inspection cost,,Yes,No,No
cost of sim card,,Yes,No,No
how much is a silver certificate one dollar bill worth from 1957,,No,No,Yes
how much is a subscription to netflix,,No,No,Yes
how do i find out how much memory my pc can have,,No,No,Yes
average retail price,,No,Yes,No
cost accounting jobs,,Yes,No,No
california universal studios prices,,No,Yes,No
does samsung pay cost anything,,Yes,No,No
nymex price natural gas,,No,Yes,No
nexgard for dogs prices,,No,Yes,No
brio ellipta price,,No,Yes,No
how much teachers get paid,,No,No,Yes
what is the cost of the university of dallas,,Yes,No,No
cost of sas software,,Yes,No,No
quetiapine prices,,No,Yes,No
price of kitchen cabinets,,No,Yes,No
stamped concrete driveway cost,yelp_intent,Yes,No,No
what is the cost of a helicopter tour in maui,,Yes,No,No
"price, ut",,No,Yes,No
how much does a brick paver weigh,,No,No,Yes
skyrim pc cost,,Yes,No,No
samsung mobile in india price,,No,Yes,No
highest price aston martin ever,,No,Yes,No
cost of microsoft project for office 365,,Yes,No,No
historical price of gold data,,No,Yes,No
cost of new passport book,,Yes,No,No
renter insurance cost,,Yes,No,No
cost of beagle puppy,,Yes,No,No
receding gums treatment cost,,Yes,No,No
island pet movers cost,,Yes,No,No
puppy shots cost,,Yes,No,No
how much publix pay,,No,No,Yes
bathroom renovations cost,,Yes,No,No
amazon delivery cost,,Yes,No,No
replacement cost profit,,Yes,No,No
cost of fujifilm instax film,,Yes,No,No
new furnace cost,,Yes,No,No
tooth filling cost,yelp_intent,Yes,No,No
how much do realtors make,,No,No,Yes
how much is aluminum for a pound,,No,No,Yes
uhaul trailer hitch installation price,,No,Yes,No
yahoo fitbit stock price,,No,Yes,No
how much is amazon stock worth today,,No,No,Yes
cost of ourtime.com,,Yes,No,No
cost of laminate sheets for counters,,Yes,No,No
starbucks cold brew cost,,Yes,No,No
cost of small wedding cake,yelp_intent,Yes,No,No
pay the price synonyms,,No,Yes,No
cost plus fixed fee completion type contract,,Yes,No,No
tenderloin roast cost,,Yes,No,No
cost of cbs all access on roku,,Yes,No,No
costco glasses cost,,Yes,No,No
how much bacon is a rasher,,No,No,Yes
how much is nursing program,,No,No,Yes
cost of motorcycle tire changer,,Yes,No,No
what airport in costa rica is close to los sueos \,,Yes,No,No
garage door installation cost,,Yes,No,No
birth control cost,,Yes,No,No
what is the cost of insulin is the us,,Yes,No,No
how much does a pool installation cost,,Yes,No,Yes
cost to install window,,Yes,No,No
cost of a large shed,,Yes,No,No
cost of jiffy lube signature oil change,,Yes,No,No
cost of regulatory compliance,,Yes,No,No
how much does vet techs make,,No,No,Yes
average cost of medicare drug plan,,Yes,No,No
pregnancy ultrasound cost,,Yes,No,No
kwh calculator cost,,Yes,No,No
interlocking retaining wall blocks price,,No,Yes,No
cost for acl reconstruction surgery,,Yes,No,No
how much does lottery tickets cost,,Yes,No,Yes
toyota extended warranties cost,,Yes,No,No
dupont dow chemical current stock price,,No,Yes,No
in ground pool liners installation cost,,Yes,No,No
cost build bella vista ar,,Yes,No,No
what does oil change cost at jiffy lube,,Yes,No,No
cost of generic wellbutrin,,Yes,No,No
cost of recreational vehicles,,Yes,No,No
driveway cost asphalt vs concrete,yelp_intent,Yes,No,No
honda price for super cub,information_intent,No,Yes,No
cost of home care services,,Yes,No,No
how much does paypal charge,,No,No,Yes
omi stock price,,No,Yes,No
jeep liberty 2003 price,,No,Yes,No
truthfinder cost,,Yes,No,No
cost of drop ceiling,,Yes,No,No
panw stock price,,No,Yes,No
what do divorce attorneys cost,,Yes,No,No
how much fiber do blueberries have,,No,No,Yes
how much grams are in an ounce,,No,No,Yes
price of water costco,,Yes,Yes,No
cost of bermuda grass seed,yelp_intent,Yes,No,No
cost top load washers,,Yes,No,No
saudi aramco ipo share price,,No,Yes,No
how much does diagnostic ultrasound,,No,No,Yes
how much does a gallon weigh,,No,No,Yes
price redmi note 4,,No,Yes,No
average diesel fuel price,,No,Yes,No
plywood sheets prices,,No,Yes,No
what is the term cost behavior,,Yes,No,No
cost of concrete slab,yelp_intent,Yes,No,No
burial plots price,,No,Yes,No
us cryotherapy cost,,Yes,No,No
vehicle graphics cost,,Yes,No,No
the cost of illegal immigration,,Yes,No,No
drywall taping cost,,Yes,No,No
how much do you have to make to afford an airplane,,No,No,Yes
headliner repair cost,,Yes,No,No
how much do ferrari's cost,,Yes,No,Yes
cost of citizenship test,,Yes,No,No
telmisartan hydrochlorothiazide cost,,Yes,No,No
how much sodium spinach,,No,No,Yes
how much is a ticket to magic kingdom orlando,,No,No,Yes
cost for kids haircuts,,Yes,No,No
rabies vaccination cost,,Yes,No,No
how much is pandora premium,,No,No,Yes
how much does a dental hygienist make hourly,,No,No,Yes
cost concrete sidewalk installation,yelp_intent,Yes,No,No
la ferrari cost,,Yes,No,No
estimate window replacement cost,,Yes,No,No
tesla model 3 replacement battery cost,,Yes,No,No
how much does botox cost,yelp_intent,Yes,No,Yes
how much is it to get your eye color change,,No,No,Yes
cost of wi uni of eau claire,,Yes,No,No
cost proposal template,,Yes,No,No
warriors finals tickets price,,No,Yes,No
cost of oven thermometer,,Yes,No,No
xlrn stock price,,No,Yes,No
typical medigap insurance costs,,Yes,No,No
cost of landscape gravel,,Yes,No,No
average cost of a crown,,Yes,No,No
cost of whole house vacuum system,,Yes,No,No
partial dentures cost,,Yes,No,No
how much do tattoos usually cost,,Yes,No,Yes
cost of freeze your eggs,,Yes,No,No
cost of opdivo,,Yes,No,No
how much is a surface pro 4,,No,No,Yes
how much does a pound equal in us dollars,,No,No,Yes
how much is rent with affordable housing,,No,No,Yes
amsterdam airport to city train cost,,Yes,No,No
land rover velar price,,No,Yes,No
cost of a baltic cruise,,Yes,No,No
vw polo price,,No,Yes,No
italian sausage cost,,Yes,No,No
commute cost calculator,,Yes,No,No
epiphone pro guitar price,,No,Yes,No
price of mitsubishi asx,,No,Yes,No
how much does a firefighter make,,No,No,Yes
barrel oil prices,,No,Yes,No
does walmart price match store brands,,No,Yes,No
hlt stock price,,No,Yes,No
cost of juvederm,,Yes,No,No
wells fargo cost center,,Yes,No,No
cost of printing a t-shirt,,Yes,No,No
how much does it cost to file for bankruptcy,,Yes,No,Yes
prices of hamilton tickets,,No,Yes,No
the cost of adding on to a business,,Yes,No,No
cost of home fresh food delivered,,Yes,No,No
cost of passport,,Yes,No,No
cost of a cell phone tower,,Yes,No,No
att&t stock prices,,No,Yes,No
price of old elvis records,,No,Yes,No
cost to fix toilet,,Yes,No,No
cost of golden retriever puppy,,Yes,No,No
jetted tub cost,,Yes,No,No
how much water to drink calculator,,No,No,Yes
iphone x india price,,No,Yes,No
how much is the president paid,,No,No,Yes
price per acre calculator,,No,Yes,No
price of bushel corn,,No,Yes,No
average trip cost in bora bora,,Yes,No,No
average cost australian terrier,,Yes,No,No
average cost of a cruise,,Yes,No,No
cost of ut 4 year degree,,Yes,No,No
cost of new electric water heater,,Yes,No,No
today's eaton stock price,,No,Yes,No
how much to make to file taxes,,No,No,Yes
cost to replace bathroom exhaust fan,,Yes,No,No
stock price enph,,No,Yes,No
price for used shipping containers,,No,Yes,No
tuition cost for university of phoenix,,Yes,No,No
how much is michael jordan worth,,No,No,Yes
how much do lpns make an hour,,No,No,Yes
cheapest price for dental implant,,No,Yes,No
chimney flue repair cost,,Yes,No,No
cost of concrete driveway,yelp_intent,Yes,No,No
price of crown molding,,No,Yes,No
cost of hearing aids',,Yes,No,No
how much can i afford for mortgage,,No,No,Yes
rv carport cost,,Yes,No,No
today gold rate chennai price,,No,Yes,No
price of synthetic grass,,No,Yes,No
alprostadil penile suppository price,,No,Yes,No
iphone s price in india,,No,Yes,No
cost of roof framing,,Yes,No,No
radiesse cost,,Yes,No,No
floor sanding cost,yelp_intent,Yes,No,No
mercedes amg gt price,,No,Yes,No
cost ceiling fans,,Yes,No,No
how much is joy mangano worth,,No,No,Yes
what is the price for ticket,,No,Yes,No
price of malwarebytes premium,,No,Yes,No
cost of mobile wifi hotspot,,Yes,No,No
price a new honda crv,information_intent,No,Yes,No
average cost of inground pool,,Yes,No,No
cost of office desk,,Yes,No,No
amc stubs cost,,Yes,No,No
what does it cost to rent a wedding dress,yelp_intent,Yes,No,No
battery price for prius,,No,Yes,No
cac cards cost per card,,Yes,No,No
how much per mile,,No,No,Yes
petco vet cost,,Yes,No,No
liposculpture cost,,Yes,No,No
cost of a toto toilet,,Yes,No,No
cost for p265/65r18 tires,,Yes,No,No
petsmart dog vaccinations cost,yelp_intent,Yes,No,No
how much is 200 pounds in stone,,No,No,Yes
1200 calorie diet how much protein,,No,No,Yes
what is amt cost,,Yes,No,No
average cost mobile pet grooming,,Yes,No,No
cost of martin guitars,,Yes,No,No
cost of building log cabin homes,,Yes,No,No
cost of cabins in gatlinburg,,Yes,No,No
how much magnesium taurate per day,,No,No,Yes
how much is it change address on a driver licence,,No,No,Yes
cost to renew green card,,Yes,No,No
uss gerald ford cost,,Yes,No,No
chr toyota price,,No,Yes,No
aviall stock price,,No,Yes,No
how much water are you supposed to drink per day,,No,No,Yes
how much it cost to build a house,,Yes,No,Yes
cost of money,,Yes,No,No
cost of attic insulation,,Yes,No,No
cost of food history,,Yes,No,No
pry asx share price,,No,Yes,No
refugee camp cost,,Yes,No,No
cost of taxi to airport,,Yes,No,No
cost of exterior door installation,,Yes,No,No
nvidia geforce gtx 970 ti price hong kong,,No,Yes,No
how much does it cost to ship a package usps,,Yes,No,Yes
porsche cayman price,,No,Yes,No
brick cost,,Yes,No,No
cost of medium dog crate,yelp_intent,Yes,No,No
hulu live unlimited screens price,,No,Yes,No
which is an example of cost push inflation,,Yes,No,No
the quantity theory of money and prices,,No,Yes,No
sildenafil generic price at cvs,,No,Yes,No
cost of an apple watch,,Yes,No,No
cost of travel in cambodia,,Yes,No,No
how much do quarters weigh,,No,No,Yes
nx closing stock price,,No,Yes,No
cost of norton renewal,,Yes,No,No
how much melatonin for sleep,,No,No,Yes
cost of decorative stone,,Yes,No,No
price of panda express,,No,Yes,No
cost of brick pavers,,Yes,No,No
average cost of living in denver,,Yes,No,No
how much peroxide to make dog vomit,,No,No,Yes
costa rica's most popular foods,,Yes,No,No
cost of laying tile,,Yes,No,No
cost us passport,,Yes,No,No
costco executive membership travel benefits,,Yes,No,No
price of puffy mattress,,No,Yes,No
hep a vaccine cost,,Yes,No,No
cost of marble tile,,Yes,No,No
cost of louisiana driver's license renewal,information_intent,Yes,No,No
how much is it to develop an app,,No,No,Yes
captur price,,No,Yes,No
cost of rv rental space,,Yes,No,No
mcafee.com total protection cost,,Yes,No,No
cost of pandora bracelets,,Yes,No,No
kfc menu with prices india,,No,Yes,No
cost of a hover camera,,Yes,No,No
home staging cost,,Yes,No,No
fisher price soothing motion bassinet,,No,Yes,No
price of santander shares,,No,Yes,No
cost of building storage shed,,Yes,No,No
price of corsage and boutonniere,,No,Yes,No
paypal cost for non-profits,,Yes,No,No
how much do nails cost at the nail salon,,Yes,No,Yes
nikon d4 price,,No,Yes,No
cost of golf cart,,Yes,No,No
how much does it cost to start a coffee shop,,Yes,No,Yes
where is costa rica,,Yes,No,No
dac stock price,,No,Yes,No
average cost of lasik,,Yes,No,No
black & decker stock price,,No,Yes,No
stock price apple,,No,Yes,No
price of propane per gallon,,No,Yes,No
cost of gas water heater replacement,,Yes,No,No
cost fire amazon,,Yes,No,No
cost of post exposure prophylaxis hiv,,Yes,No,No
fda approval cost,,Yes,No,No
how much does a keg gas hold,,No,No,Yes
cost of ferry to mackinac island,,Yes,No,No
fence installation cost,yelp_intent,Yes,No,No
how much sleep do kids need to get,,No,No,Yes
stitch fix cost,,Yes,No,No
lamborghini veneno cost,,Yes,No,No
how does it cost to wrap a car,,Yes,No,No
stock price for oil,,No,Yes,No
cost of installed granite countertops,yelp_intent,Yes,No,No
cost of interior doors,,Yes,No,No
how much vitamin c for kids,,No,No,Yes
certified medical assistant exam cost,,Yes,No,No
how much are pugs,,No,No,Yes
cost of average funeral,,Yes,No,No
how much does mechanic make,,No,No,Yes
cost to register boat in florida,,Yes,No,No
cost of cataract surgery,,Yes,No,No
cialis vs levitra cost,,Yes,No,No
parking pittsburh airport cost,,Yes,No,No
how to order a costco sheet cake,,Yes,No,No
cost of granite kitchen counters,,Yes,No,No
what's the price for aluminum cans,,No,Yes,No
how much is the beats wireless headphones,,No,No,Yes
cost of snack bars,,Yes,No,No
cost of esthetician school,,Yes,No,No
us open tennis ticket price,,No,Yes,No
cost for bermuda sod,,Yes,No,No
cost to visit puerto vallarta,,Yes,No,No
rick simpson oil price,,No,Yes,No
how much does it cost finish a basement,,Yes,No,Yes
cost home depot truck rental mileage,,Yes,No,No
how much to refinish hardwood floors,,No,No,Yes
cost to have whole house generator installed,,Yes,No,No
cost of a root canal,,Yes,No,No
how much does a licensed insurance agent make,,No,No,Yes
price of dom perignon champagne,,No,Yes,No
cost of direct cremation,yelp_intent,Yes,No,No
how much does playstation plus cost,,Yes,No,Yes
how much do rn make a year,,No,No,Yes
jennifer james price,,No,Yes,No
how much should i spend on an engagement ring,,No,No,Yes
honomobo home cost,,Yes,No,No
what does a dpf delete cost,,Yes,No,No
stcw cost,,Yes,No,No
how much is a generac generator,,No,No,Yes
how much money should i have at retirement,,No,No,Yes
pipe insulation cost breakdown,,Yes,No,No
cost of prefab houses,,Yes,No,No
how much can i get unemployment,,No,No,Yes
cost per square foot to build house,,Yes,No,No
american airlines inflight wifi cost,,Yes,No,No
how much of social security income is taxable,,No,No,Yes
price concrete,,No,Yes,No
cost to build brick wall,,Yes,No,No
cost of business license in california,information_intent,Yes,No,No
cost of a cruise to cuba,,Yes,No,No
how cost rent car for a month,,Yes,No,No
prices of lamborghini veneno,,No,Yes,No
what is cost basis,,Yes,No,No
how much is alexa service,,No,No,Yes
how much are fujifilm polaroid camera,,No,No,Yes
tesla roof panels cost,,Yes,No,No
how much should i expect in salary for having a pmp certification,,No,No,Yes
tosbf stock price,,No,Yes,No
what is the cost for a septic system,,Yes,No,No
stock price for reebok,,No,Yes,No
bridgestone tires prices,,No,Yes,No
simple cost plus construction contract,,Yes,No,No
cost of a po box,,Yes,No,No
average car insurance cost per month,,Yes,No,No
how much money does a veterinarian specialist make,,No,No,Yes
how much money can i send with zelle,,No,No,Yes
prices for kia sportage,,No,Yes,No
when will social security cost of living increase,,Yes,No,No
cost of whole life insurance vs term life,,Yes,No,No
how much is a iphone 5c,,No,No,Yes
cost to build a block foundation,,Yes,No,No
upmc anywhere care cost,,Yes,No,No
ac replacement cost,,Yes,No,No
how much does a average nfl player make,,No,No,Yes
how much is long term parking at lax,,No,No,Yes
cost of bpm software,,Yes,No,No
salary cost analyst,,Yes,No,No
average fixed costs,,Yes,No,No
stock price xlf,,No,Yes,No
weighted average costs,,Yes,No,No
how much debt does china have as % of gdp,,No,No,Yes
cost of coconut rum,,Yes,No,No
how much meat per person for a party brisket,,No,No,Yes
piggly wiggly price list,,No,Yes,No
how much does a pharmacist make,,No,No,Yes
how much does a local news anchor make,,No,No,Yes
how much epsom salts for tomatoes,,No,No,Yes
pjt stock price,,No,Yes,No
prices of comic books,,No,Yes,No
cost of foot surgery,,Yes,No,No
price quartz counters,,No,Yes,No
how much does us senator make,,No,No,Yes
spot price for silver today,,No,Yes,No
low cost neutering for dogs,yelp_intent,Yes,No,No
costa rican spanish to english translation,,Yes,No,No
scana stock price,,No,Yes,No
how much to paint a room,,No,No,Yes
steel edging price,,No,Yes,No
how much does a car engine weigh,,No,No,Yes
generic plaquenil cost,,Yes,No,No
stock price iwm,,No,Yes,No
at&t inc stock price,,No,Yes,No
price list of beltone hearing aids,,No,Yes,No
cost of google express for costco,,Yes,No,No
24 carat gold price,,No,Yes,No
lowest gas prices in usa,,No,Yes,No
steel homes cost,,Yes,No,No
how much does it cost to remodel kitchen,,Yes,No,Yes
cost of moving van,,Yes,No,No
how much does home depot pay,,No,No,Yes
cost to repair washer,,Yes,No,No
is costa rican food good,,Yes,No,No
how much paint to paint garage,,No,No,Yes
how much sleep is too much sleep,,No,No,Yes
titan x pascal price,,No,Yes,No
how much does 3d printer cost,,Yes,No,Yes
how much cholesterol per day for heart disease,,No,No,Yes
price for kirkland vodka,,No,Yes,No
insuranc fraud cost,,Yes,No,No
lawn service cost,,Yes,No,No
cost of vaccinations at petco,,Yes,No,No
average cost of propane,,Yes,No,No
books at a discounted price,,No,Yes,No
