sequence,target,cost,price,how much
cost of ziplining in maui,,Yes,No,No
how much are chair lifts for stairs,,No,No,Yes
price of newborn diapers,,No,Yes,No
cost of metal detector,,Yes,No,No
cost of imac pro,,Yes,No,No
how much does a real estate investor make,,No,No,Yes
rabies shot cost,,Yes,No,No
how much mm is an inch,,No,No,Yes
cost to file for divorce,,Yes,No,No
abdominoplasty surgery cost,,Yes,No,No
real time stock price,information_intent,No,Yes,No
price of polished concrete floors,,No,Yes,No
bose stock price history,information_intent,No,Yes,No
cost of iaas,,Yes,No,No
average cost of an uber ride,,Yes,No,No
cost to build deck,yelp_intent,Yes,No,No
how much urine does the average female bladder hold,,No,No,Yes
hpe stock prices,information_intent,No,Yes,No
sangamo stock price,information_intent,No,Yes,No
cost of computer repair,,Yes,No,No
cost of an endometrial biopsy,,Yes,No,No
how much kilobyte is in a megabyte,,No,No,Yes
cost of a cake boss cake,,Yes,No,No
cost for thatching lawn,,Yes,No,No
full implant dentures cost,,Yes,No,No
austin peay university cost,,Yes,No,No
zinc price per ounce,,No,Yes,No
inogen oxygen concentrator price,,No,Yes,No
how much should i budget to add on to the house,,No,No,Yes
what is the price for vehicle emissions testing,,No,Yes,No
blackberry stock price,information_intent,No,Yes,No
cost of eye corrective surgery,,Yes,No,No
"star wars x-wing game, lost cost",,Yes,No,No
australian shepherd price,,No,Yes,No
cost install landscape edging,,Yes,No,No
how much mg is in a meq,,No,No,Yes
audi stock price,information_intent,No,Yes,No
cost of drywall ceiling,,Yes,No,No
residential metal roofing cost,,Yes,No,No
how much are amazon stocks,,No,No,Yes
txt stock price,information_intent,No,Yes,No
kb home stock price,information_intent,No,Yes,No
how much do veterinarians make a year,,No,No,Yes
cost of an oil change for a bugatti?,,Yes,No,No
burger king menu price,,No,Yes,No
malibu rum price,,No,Yes,No
cost to install a mini split system,,Yes,No,No
"home sale prices in griffith, indiana",,No,Yes,No
weighted average cost method,,Yes,No,No
cost of piercing ears at claire's,,Yes,No,No
price of piano tuning,,No,Yes,No
gender selection cost,,Yes,No,No
guardian ad litem cost,,Yes,No,No
aaa predictions on gas prices,,No,Yes,No
what cost of snow software,,Yes,No,No
price for one bitcoin,,No,Yes,No
ab stock price,information_intent,No,Yes,No
cost to install interior door home depot,,Yes,No,No
mesalamine enema cost,,Yes,No,No
glass tile backsplash cost,,Yes,No,No
average cost of wedding gowns by designer,yelp_intent,Yes,No,No
meningococcal vaccine cost,,Yes,No,No
what is functional replacement cost,,Yes,No,No
cost of eye laser surgery,,Yes,No,No
audi r8 alignment cost,,Yes,No,No
legion of merit cost,,Yes,No,No
average cost to install backsplash in kitchen,,Yes,No,No
cost benefit of electronic medical records,,Yes,No,No
cost of shocks and struts,,Yes,No,No
priceline rental car age,,No,Yes,No
price of patio stone,,No,Yes,No
millet grain price,,No,Yes,No
brk b target price,,No,Yes,No
stock price of tmus,information_intent,No,Yes,No
fisker karma base price,,No,Yes,No
how much to spend on wedding gift,,No,No,Yes
cost google cloud platform,,Yes,No,No
vrns stock price,information_intent,No,Yes,No
traveling thailand cost,,Yes,No,No
how much student loan debt,,No,No,Yes
ceramic tile installation price list,,No,Yes,No
apple stock today price,,No,Yes,No
how much is a terabyte of data,,No,No,Yes
how much does lebron weigh,,No,No,Yes
cost of sirius xm subscription,,Yes,No,No
private college cost,,Yes,No,No
how much meat per day for a man,,No,No,Yes
what is a cost accountant,,Yes,No,No
cost of a business license,information_intent,Yes,No,No
how much does braces cost for children,,Yes,No,Yes
cost of have sprinkler system installed,,Yes,No,No
how much is home insurance calculator,,No,No,Yes
serena williams how much she weight,,No,No,Yes
cost of selling tickets on ticketmaster,,Yes,No,No
average closing costs for seller,,Yes,No,No
how much are closing costs on a home,,Yes,No,Yes
cost to install barbed wire fence,yelp_intent,Yes,No,No
how much is an antique singer sewing machine worth,,No,No,Yes
what is the cost of living in los angeles ca,,Yes,No,No
how to calculate the average cost,,Yes,No,No
hardwood flooring cost,yelp_intent,Yes,No,No
how much to tile a kitchen backsplash,,No,No,Yes
nice price favors coupon codes,,No,Yes,No
litecoin price valuation,,No,Yes,No
tesla cost of ownership,,Yes,No,No
how much does the average tattoo cost,,Yes,No,Yes
cost for full denture implants,,Yes,No,No
how much horsepower do i need for a garage door opener,,No,No,Yes
cost for replacing alternator,,Yes,No,No
stock price growth rate,information_intent,No,Yes,No
average cost of living austin tx,,Yes,No,No
cost of front end alignment at discount tire,,Yes,No,No
price target bo,,No,Yes,No
cost of equity for,,Yes,No,No
how much is coursera courses,,No,No,Yes
cost of refacing cabinets,,Yes,No,No
long distance movers cost,,Yes,No,No
cost of pellet stove,,Yes,No,No
how much is james harden contract,,No,No,Yes
bxmt stock price today per share,information_intent,No,Yes,No
cost of carpet installation,,Yes,No,No
where is costa mesa ca,,Yes,No,No
how much do dental implants cost,yelp_intent,Yes,No,Yes
intake manifold gasket replacement cost,,Yes,No,No
disney vacation club cost,,Yes,No,No
price of garage door installation,,No,Yes,No
average cost of oil pan gasket replacement,,Yes,No,No
how much can a woman legally have an abortion,,No,No,Yes
anhydrous ammonia prices,,No,Yes,No
what is the cost for office home and student,,Yes,No,No
current united healthcare stock price,information_intent,No,Yes,No
how much is installation for tile backsplash,,No,No,Yes
becn stock price,information_intent,No,Yes,No
fqhc cost reporting requirement,,Yes,No,No
how much sodium per day,,No,No,Yes
cost of building block wall,,Yes,No,No
how much will college cost,,Yes,No,Yes
how much money do actors make per year,,No,No,Yes
samsung a5 price,,No,Yes,No
how much trazodone is an overdose,,No,No,Yes
cost to tile a shower,,Yes,No,No
door lock replacement cost,,Yes,No,No
replacement cost coverage definition,,Yes,No,No
cost of outdoor furnace,,Yes,No,No
cost of modular home addition,,Yes,No,No
price of sunpower solar panels,,No,Yes,No
cost of healthcare for individual,,Yes,No,No
cost of in home assisted living,,Yes,No,No
primerica stock price ytd,information_intent,No,Yes,No
natural gas boiler prices,,No,Yes,No
cleveland browns season ticket prices,,No,Yes,No
how much does a respiratory therapist,,No,No,Yes
cost of basement panel insulation,,Yes,No,No
gross price definition,,No,Yes,No
cost of title indemnity insurance,,Yes,No,No
cost of publishing books,,Yes,No,No
irap therapy cost,,Yes,No,No
dental implants cost,yelp_intent,Yes,No,No
cost of a logo design,,Yes,No,No
cost of a trex transcend deck,yelp_intent,Yes,No,No
cost for stone veneer installation,,Yes,No,No
train cost from madrid to munich,,Yes,No,No
cost to install central air conditioning,yelp_intent,Yes,No,No
cost of mini cooper car,,Yes,No,No
how much it cost for bathroom remodel,,Yes,No,Yes
how much do neurosurgeons,,No,No,Yes
cp stock price,information_intent,No,Yes,No
how much is minimum wage in nj,,No,No,Yes
cost for adn to msn,,Yes,No,No
cost of mouth guard for sleep apnea,,Yes,No,No
how much is electrolysis hair removal,,No,No,Yes
cost to get a teaching certificate,,Yes,No,No
cost of a do it yourself divorce,,Yes,No,No
cost of fentanyl patch,,Yes,No,No
lowes vinyl siding price,,No,Yes,No
urban movie channel cost,,Yes,No,No
how much does a orthodontist make,,No,No,Yes
stock price for emerson ele,information_intent,No,Yes,No
how much does it cost for eye lift surgery,,Yes,No,Yes
which grocery store has the best prices,,No,Yes,No
how much should i use of a dependant care fsa,,No,No,Yes
does costco take mastercard credit cards,,Yes,No,No
average cost of breast augmentation,,Yes,No,No
tummy tuck price,,No,Yes,No
how much does it cost to paint a house/,,Yes,No,Yes
cost to build a house,,Yes,No,No
price elasticity of supply and demand,,No,Yes,No
total cost of climbing mt. everest,,Yes,No,No
how much is an audi a8l,,No,No,Yes
price of us stamp,,No,Yes,No
cost of floor coverings,yelp_intent,Yes,No,No
ekg certification cost,,Yes,No,No
what is the cost for amazon music unlimited,,Yes,No,No
cost of gravel for driveway,,Yes,No,No
cost of after school care,,Yes,No,No
cost for email marketing software,,Yes,No,No
vr system price,,No,Yes,No
house price estimate zillow,,No,Yes,No
current stock price of adt,information_intent,No,Yes,No
cost of helix bridge,,Yes,No,No
cost large landscape rocks,,Yes,No,No
how much does it cost to declaw cat,,Yes,No,Yes
price for a bushel of crabs,,No,Yes,No
cost to install a fence,yelp_intent,Yes,No,No
what's the copper spot price,,No,Yes,No
goos stock price,information_intent,No,Yes,No
how much protein does science diet,,No,No,Yes
jr bacon cheeseburger price,,No,Yes,No
price of tickets to pga tour,,No,Yes,No
price of acura nsx,,No,Yes,No
methods of calculating cost of capital,,Yes,No,No
mgnx stock price,information_intent,No,Yes,No
lowes flooring installation cost,yelp_intent,Yes,No,No
adobe creative cloud suite software price,,No,Yes,No
how much it cost to hang drywall,,Yes,No,Yes
how much does a yard of fill dirt weigh,,No,No,Yes
consumer price index history,,No,Yes,No
ethereum classic future price,,No,Yes,No
how much is medicare part b premium,,No,No,Yes
yield to maturity bond price,,No,Yes,No
plantation shutter for sliding door price,,No,Yes,No
uber stock prices,information_intent,No,Yes,No
price to purchase shipping container,,No,Yes,No
stock price oo,information_intent,No,Yes,No
cost of steps for above ground pools,,Yes,No,No
kroger clicklist cost,,Yes,No,No
dealer price for toyota prius,,No,Yes,No
price of costco universal studios tickets,,Yes,Yes,No
cost of daliresp medication,,Yes,No,No
how much do psychologists make,,No,No,Yes
cost for ads on facebook,,Yes,No,No
inventory costs definition,,Yes,No,No
how much does a marine biologist make,,No,No,Yes
ice sculpture cost,,Yes,No,No
how much protein should you have a day,,No,No,Yes
cost to replace iphone battery,,Yes,No,No
schwab stock price,information_intent,No,Yes,No
price to remodel a small kitchen,,No,Yes,No
atcv stock price,information_intent,No,Yes,No
mini countryman cost,,Yes,No,No
iphone x price at tmobil,,No,Yes,No
how much is one mole,,No,No,Yes
cost to attend long beach state,,Yes,No,No
kaiser average cost of health insurance,,Yes,No,No
kite pharma stock target price,,No,Yes,No
add bathroom to basement cost,,Yes,No,No
cost of book of stamps to change,,Yes,No,No
how much does a new furnace cost,,Yes,No,Yes
cost of small cabin modular home,,Yes,No,No
how much does steve harvey net worth,,No,No,Yes
price for qdoba catering,,No,Yes,No
cost of cultured marble shower installed,,Yes,No,No
cost install sump pump,,Yes,No,No
what is the average cost for an eye exam,,Yes,No,No
cost of diy outdoor kitchen,,Yes,No,No
cost to euthanize dog,yelp_intent,Yes,No,No
brake replacement cost,yelp_intent,Yes,No,No
how much are safety prescription glasses,,No,No,Yes
price to put in an inground pool,,No,Yes,No
cost of salary surveys,,Yes,No,No
dewalt planer cost,,Yes,No,No
casey's stock price,information_intent,No,Yes,No
cost of replacing carpet,,Yes,No,No
how much does lasik usually cost,,Yes,No,Yes
lng carrier operating cost,,Yes,No,No
richie brace cost,,Yes,No,No
average cost of chantix,,Yes,No,No
botz etf price,,No,Yes,No
prices for countertops for kitchens,,No,Yes,No
breast augmentation vancouver cost,,Yes,No,No
note 8 phone price,,No,Yes,No
customer price increase letter,,No,Yes,No
bitcoin price please,,No,Yes,No
how much for uber ride,,No,No,Yes
cost of oak wood,,Yes,No,No
define future price,,No,Yes,No
how much is vipre internet security,,No,No,Yes
how much does it cost to get a business license,information_intent,Yes,No,Yes
how much is derek jeter worth,,No,No,Yes
price gmc yukon xl,,No,Yes,No
coffee price news,,No,Yes,No
how much to install vinyl siding,,No,No,Yes
how much should you have saved at retirement,,No,No,Yes
cobalt price,,No,Yes,No
price of an acura,,No,Yes,No
delta airline prices & schedules,,No,Yes,No
how much a wedding planner cost,yelp_intent,Yes,No,Yes
how much does it cost a mammogram,,Yes,No,Yes
how much a real estate agent make,,No,No,Yes
how much for a new furnace,,No,No,Yes
english setter cost,,Yes,No,No
gas price california,,No,Yes,No
how much a gallon of water weigh,,No,No,Yes
price of new golf cart,,No,Yes,No
how much to give for wedding gift,,No,No,Yes
cost of attendance csn,,Yes,No,No
cost of beveled mirror,,Yes,No,No
hardwood floor cost,yelp_intent,Yes,No,No
cost of implant supported dentures,,Yes,No,No
cost of interior window shutters,,Yes,No,No
nurse anesthetist program cost,,Yes,No,No
celine dion concert price,,No,Yes,No
blueberry tree cost,,Yes,No,No
walt disney world orlando florida price,,No,Yes,No
cost to go solar,yelp_intent,Yes,No,No
laser genesis price,,No,Yes,No
cost of custom fitting closets,,Yes,No,No
american airlines stock price,information_intent,No,Yes,No
braidy industries charles price,,No,Yes,No
what does a maserati ghibli cost,,Yes,No,No
cost of scuba diving lessons,,Yes,No,No
how much does a tesla cost,,Yes,No,Yes
professional cleaning area rugs cost,,Yes,No,No
cost of hiv treatment,,Yes,No,No
how much does the president of the us make a year,,No,No,Yes
walmart wedding cake prices,,No,Yes,No
standard costs associated to a transaction,,Yes,No,No
what is the map of costa rica,,Yes,No,No
cost of tidal energy,,Yes,No,No
when is the rainy season in costa rica,,Yes,No,No
cost of tiny home,,Yes,No,No
dividends vs stock price,information_intent,No,Yes,No
how much does electrical engineer make,,No,No,Yes
how much do rowing machines sell for,,No,No,Yes
newfield exploration stock price,information_intent,No,Yes,No
cost of new glasses,,Yes,No,No
harsco stock price,information_intent,No,Yes,No
how much are batting cages,,No,No,Yes
cost of kia niro new,,Yes,No,No
puppy vaccinations cost,,Yes,No,No
cost for propane furnace,,Yes,No,No
cost of binghamton university tuition,,Yes,No,No
sprwf stock price,information_intent,No,Yes,No
how much do game writers make,,No,No,Yes
how much sugar is enough,,No,No,Yes
cvs ventolin hfa cost,,Yes,No,No
florida residents price for disney world,,No,Yes,No
how much in a baker's dozen,,No,No,Yes
ipl laser cost,,Yes,No,No
ev charging system cost,,Yes,No,No
digital subscription cost the economist,,Yes,No,No
cost of gutters and downspouts,,Yes,No,No
cost to take the staten island ferry,,Yes,No,No
how much fruits and vegetables should we eat,,No,No,Yes
cost to replace compressor in air conditioner,yelp_intent,Yes,No,No
what do storage containers cost to buy,,Yes,No,No
annual cost tankless water heater,,Yes,No,No
how much is it to get a marriage license in pa county,,No,No,Yes
cost to mount brackets,,Yes,No,No
lpg price,,No,Yes,No
average living cost in florida,,Yes,No,No
cost based pricing cloud,,Yes,No,No
how much is a pound to a dollar,,No,No,Yes
highest gold price per ounce,,No,Yes,No
cost for renewing license,information_intent,Yes,No,No
how much to reupholster a couch,,No,No,Yes
how much protein does an milk have,,No,No,Yes
install ceiling fan cost,,Yes,No,No
how much is a meter stamp,,No,No,Yes
powerball system cost,,Yes,No,No
garage door repair cost,,Yes,No,No
average price for double wide mobile home,,No,Yes,No
cost effective means,,Yes,No,No
university delaware cost,,Yes,No,No
how much do cnc machinist make,,No,No,Yes
general generators prices,,No,Yes,No
cost of application for us passport,,Yes,No,No
cost for a slab foundation,,Yes,No,No
stock price frontier communications,information_intent,No,Yes,No
cost of dragon software,,Yes,No,No
how much to recharge air conditioner freon,,No,No,Yes
james o'halloran price,,No,Yes,No
price per earning stock,,No,Yes,No
what is the cost of living in new mexico,,Yes,No,No
phone price in bangladesh,,No,Yes,No
northwest vista college price,,No,Yes,No
urgent care cost,,Yes,No,No
smci stock price,information_intent,No,Yes,No
cost for building a barn,,Yes,No,No
how much do dentures usually cost,,Yes,No,Yes
cost to install engineered hardwood flooring,yelp_intent,Yes,No,No
hep a shot cost,,Yes,No,No
amantadine dogs price,,No,Yes,No
how much is a ton too,,No,No,Yes
cashier check cost chase,,Yes,No,No
hgh injections cost,,Yes,No,No
iphone 6s repair price,,No,Yes,No
wind turbine cost,,Yes,No,No
prices of lamborghini countach,,No,Yes,No
how much is a home inspection,,No,No,Yes
stock price for corning inc.,information_intent,No,Yes,No
price to install storm door,,No,Yes,No
cost of visiting sweden,,Yes,No,No
what is the cost for costco military membership,,Yes,No,No
how much does the u.s. owe china,,No,No,Yes
average cost of a funeral,,Yes,No,No
federal cost of death penalty,,Yes,No,No
cost of heating in air conditioning,yelp_intent,Yes,No,No
how much does a bar of gold worth,,No,No,Yes
how much a stocker gets pay at costco,,Yes,No,Yes
kitchen base cabinets cost,,Yes,No,No
price of colonoscopy,,No,Yes,No
direct mail postcards cost,,Yes,No,No
artificial pancreas cost,,Yes,No,No
graphite share price,,No,Yes,No
ethereum price to usd,,No,Yes,No
wayfair ipo price,,No,Yes,No
cost of marijuana in colorado,,Yes,No,No
cost of iui,,Yes,No,No
how much does solar panels cost to install,yelp_intent,Yes,No,Yes
brick veneer cost per brick,,Yes,No,No
is sales commission a product cost,,Yes,No,No
how much of the earth surface is covered by oceans?,,No,No,Yes
how much vitamin d3 should a person get daily,,No,No,Yes
cost of gas in florida,,Yes,No,No
johnny walker platinum label price,,No,Yes,No
cost of ablation therapy,,Yes,No,No
timolol prices,,No,Yes,No
cost of illegal immigrants living without social security,,Yes,No,No
what is the cost of an llc in california,,Yes,No,No
total annual fixed cost formula,,Yes,No,No
cost of event planners,,Yes,No,No
how much fat calories per day,,No,No,Yes
cost to replace a/c capacitor,,Yes,No,No
pfizer share price,,No,Yes,No
how much does photoshop cost,,Yes,No,Yes
cost of replacement passport,,Yes,No,No
cost for drone registration',,Yes,No,No
trailer hitches installed cost,,Yes,No,No
labor cost for installing pull down attic stairs,,Yes,No,No
stock price ups,information_intent,No,Yes,No
walt disney world hotels prices,,No,Yes,No
cost of operating a propane pool heater,,Yes,No,No
how much are closing costs,,Yes,No,Yes
how much does it cost to have dog euthanized,yelp_intent,Yes,No,Yes
cost of quartz countertops installed,yelp_intent,Yes,No,No
prices of lenovo phones,,No,Yes,No
buick envision loaded price,,No,Yes,No
how much protein is in bacon,,No,No,Yes
what is region of costa rica,,Yes,No,No
nflx stock price?,information_intent,No,Yes,No
berkshire hathaway history of stock price,information_intent,No,Yes,No
bio k probiotic price,,No,Yes,No
cost of new macbook pro,,Yes,No,No
what is corticosteroid cream for,,Yes,No,No
how much does a cigarettes cost,,Yes,No,Yes
how much milk does a cow produce in a day,,No,No,Yes
how much do a doctor get paid,,No,No,Yes
what is price limit,,No,Yes,No
cost of chemical peel,,Yes,No,No
how much does a gallon of milk cost,,Yes,No,Yes
how much does it cost to repaint car,,Yes,No,Yes
asphalt driveways cost calculator,,Yes,No,No
closing silver prices,,No,Yes,No
price for aluminum recycle,,No,Yes,No
mri cost,,Yes,No,No
how much is a swamp cooler,,No,No,Yes
cost of home care for elderly,,Yes,No,No
amazon laptop price,,No,Yes,No
how much is a ktm superduke 1290,,No,No,Yes
how much does water weigh,,No,No,Yes
how much do marine biologist make,,No,No,Yes
what does hurricane insurance cost,,Yes,No,No
cost of hormone pellet therapy,,Yes,No,No
cost to install office,,Yes,No,No
cost for filing divorce papers in california,,Yes,No,No
cost of stitches removal,,Yes,No,No
oil prices fall in 2014,,No,Yes,No
xbox cloud cost,,Yes,No,No
lower of cost or market change,,Yes,No,No
beef brisket cost,,Yes,No,No
cost of chi garage doors,,Yes,No,No
lantus cost,,Yes,No,No
iverhart max cost,,Yes,No,No
how much is income tax,,No,No,Yes
cost of fiberglass inground pools,,Yes,No,No
cost of maid service,,Yes,No,No
cost of kitchen cabinets by manufacturer,,Yes,No,No
cost effectiveness of hiv prevention,,Yes,No,No
how much do doctors make a year,,No,No,Yes
what is oil price per barrel,,No,Yes,No
cost for ged test,,Yes,No,No
wells fargo closing cost estimator,,Yes,No,No
share price of papa john,,No,Yes,No
price value for brass,,No,Yes,No
how much is a peloton tread,,No,No,Yes
cost of tier 1 capital,,Yes,No,No
cost to rent uhaul,,Yes,No,No
mlb package price,,No,Yes,No
price on composite decking,,No,Yes,No
avanade stock price,,No,Yes,No
pg pre market stock price,,No,Yes,No
what is current price of silver,,No,Yes,No
how much data does spotify use an hour,,No,No,Yes
transmission flush cost,,Yes,No,No
trike trike cost,,Yes,No,No
cost of cardiac ablation,,Yes,No,No
cost of faux locs,,Yes,No,No
cost for bag of ice,,Yes,No,No
lamborghini price,,No,Yes,No
hypoallergenic cats cost,,Yes,No,No
aca increased healthcare costs,,Yes,No,No
paypal stock price,,No,Yes,No
cost of a pet scan machine,yelp_intent,Yes,No,No
how much is time warner cable,,No,No,Yes
how much does auburn pharmacy pay for pharmacies,,No,No,Yes
how much does godaddy ssl certificate cost,,Yes,No,Yes
tricare cost for retirees,,Yes,No,No
stock price for winnebago industries,,No,Yes,No
how much can estheticians make,,No,No,Yes
how much is a driver's license renewal,,No,No,Yes
how much is nc vehicle registration,,No,No,Yes
cost of goods sold per unit,,Yes,No,No
concrete pavers cost,yelp_intent,Yes,No,No
average cost of living for 60 year old,,Yes,No,No
how much money does a lawyer make a day,,No,No,Yes
kgc price,,No,Yes,No
average loan costs,,Yes,No,No
how much water should you drink daily,,No,No,Yes
metal drilling machine cost,,Yes,No,No
what is the approximate cost of progressive contact lenses,,Yes,No,No
what does lyft cost,,Yes,No,No
cost for synthetic oil change,,Yes,No,No
cost for window framing,,Yes,No,No
moneygram from walmart price,,No,Yes,No
how much water does a 9kg washing machine use,,No,No,Yes
microsoft project tutorial price,,No,Yes,No
how much can i get for college financial aid,,No,No,Yes
price proventil inhaler,,No,Yes,No
how much money is ariana grande worth,,No,No,Yes
double chin reduction surgery cost,,Yes,No,No
how much does kim tae hee,,No,No,Yes
stock price regn,,No,Yes,No
m stock price,,No,Yes,No
styrene monomer price,,No,Yes,No
how does the large big green egg cost,,Yes,No,No
medicare cost plans definition,,Yes,No,No
cost of long term debt excel,,Yes,No,No
autocad cost,,Yes,No,No
cost chain link fence,yelp_intent,Yes,No,No
sony radio price,,No,Yes,No
bitcoin price drop reddit,,No,Yes,No
cost of an abdominal ct scan,yelp_intent,Yes,No,No
filet mignon price,,No,Yes,No
how much vegetables,,No,No,Yes
how much is an executive mba program,,No,No,Yes
liquid fertilizer prices,,No,Yes,No
cost to launch space shuttle,,Yes,No,No
it certification cost,,Yes,No,No
cost of residential lifts,,Yes,No,No
subaru starlink cost,,Yes,No,No
home siding cost estimator,,Yes,No,No
nanny services cost,,Yes,No,No
how much is one american dollar in euros,,No,No,Yes
woodford reserve bourbon price,,No,Yes,No
beamer car price,,No,Yes,No
new amsterdam vodka red berry cost,,Yes,No,No
manulife financial stock price,,No,Yes,No
dental bonding cost,yelp_intent,Yes,No,No
moving cost,,Yes,No,No
brick pavers driveway cost,,Yes,No,No
how much are nose jobs,,No,No,Yes
how much do dentists make,,No,No,Yes
how much do programmers make part time,,No,No,Yes
how much does a amazon fire tablet,,No,No,Yes
perrigo stock price,,No,Yes,No
exterior windows cost,,Yes,No,No
what is index cost of living,,Yes,No,No
cost of retail shipping container,,Yes,No,No
how much does wendy's pay hourly,,No,No,Yes
how much does an emirates flight attendant make,,No,No,Yes
cisco firewall price,,No,Yes,No
cost of high speed steel,,Yes,No,No
price of rocket fuel,,No,Yes,No
cost for termite treatments,,Yes,No,No
how much are the new teslas,,No,No,Yes
cost of epdm rubber roofing,,Yes,No,No
how much do general surgeons make,,No,No,Yes
cost of living in manarola italy,,Yes,No,No
how much schooling for nurse practitioner,,No,No,Yes
nand memory price,,No,Yes,No
forward helix piercing price,,No,Yes,No
radiator hose price,,No,Yes,No
how much should i withhold from federal taxes,,No,No,Yes
cost of water softeners,,Yes,No,No
weather in costa rica in,,Yes,No,No
cvx price,,No,Yes,No
taro tacrolimus cost,,Yes,No,No
walgreens stock price google,,No,Yes,No
definition of stock price,,No,Yes,No
price for pruning trees,,No,Yes,No
cost of handicap toilet,,Yes,No,No
truck rental cost,,Yes,No,No
how much weight to lose in a month,,No,No,Yes
cost of gravel driveway,,Yes,No,No
cost to install wood floors,yelp_intent,Yes,No,No
what is current price,,No,Yes,No
cost of black chain link fence installed,yelp_intent,Yes,No,No
ande stock price,,No,Yes,No
kohl's stock price,,No,Yes,No
cost of house painting,,Yes,No,No
cost of inground swimming pool,,Yes,No,No
bqe core price,,No,Yes,No
freighter cruise cost,,Yes,No,No
cost to replace window seals,,Yes,No,No
closing cost for a house,,Yes,No,No
cost of ultherapy,,Yes,No,No
how much do a phlebotomist make,,No,No,Yes
cost of pdf architect,,Yes,No,No
flower foods stock price,,No,Yes,No
